{
  "$schema": "http://json-schema.org/draft-07/schema#",
  "$id": "https://example.com/songbook.schema.json",
  "title": "Song",
  "description": "Schema for song JSON format",
  "type": "object",
  "required": [
    "meta",
    "title",
    "verses"
  ],
  "properties": {
    "meta": {
      "type": "object",
      "properties": {
        "page": {
          "description": "Page number(s) in the songbook",
          "oneOf": [
            {
              "type": "number"
            },
            {
              "type": "string"
            },
            {
              "type": "array",
              "items": {
                "type": "number"
              },
              "minItems": 1
            }
          ]
        },
        "first_line": {
          "description": "First line of the song",
          "type": "string"
        },
        "alt_first_lines": {
          "description": "Alternative first line(s) of the song",
          "oneOf": [
            {
              "type": "string"
            },
            {
              "type": "array",
              "items": {
                "type": "string"
              },
              "minItems": 1
            }
          ]
        },
        "author": {
          "description": "Author of the song (single string in meta)",
          "type": "string"
        },
        "no-author": {
          "description": "Flag indicating no author (value must be 1)",
          "enum": [
            1
          ],
          "type": "number"
        },
        "translation": {
          "description": "Translation status (only \"no\" is allowed)",
          "enum": [
            "no",
            "auto"
          ],
          "type": "string"
        },
        "translator": {
          "description": "Translator(s) of the song",
          "oneOf": [
            {
              "type": "string"
            },
            {
              "type": "array",
              "items": {
                "type": "string"
              },
              "minItems": 1
            }
          ]
        },
        "version": {
          "description": "Version of the document",
          "type": "string"
        },
        "styles": {
          "description": "Optional styling options for the song",
          "type": "object",
          "properties": {
            "verses": {
              "description": "Styling options for verses",
              "type": "object",
              "properties": {
                "wide": {
                  "description": "When false, disables auto wide layout for long-line verses",
                  "type": "boolean"
                },
                "align": {
                  "description": "When \"left\", forces left alignment without left margin for wide verses that are not wide enough for auto detection",
                  "enum": [
                    "left"
                  ],
                  "type": "string"
                },
                "inline": {
                  "description": "Treat verses without numbers as inline translation quotations; hidden in \"hide translation\" mode",
                  "type": "object",
                  "properties": {
                    "bold": {
                      "description": "When false, inline verses are rendered non bold",
                      "type": "boolean"
                    }
                  },
                  "additionalProperties": false
                }
              },
              "additionalProperties": false
            }
          },
          "additionalProperties": false
        }
      },
      "required": [
        "first_line"
      ],
      "additionalProperties": false,
      "description": "Metadata about the song"
    },
    "title": {
      "type": "array",
      "items": {
        "type": "string"
      },
      "description": "Song title(s)",
      "minItems": 1
    },
    "word_by_word": {
      "type": "array",
      "items": {
        "type": "string"
      },
      "description": "Word-by-word translation for the entire song"
    },
    "author": {
      "type": "array",
      "items": {
        "type": "string"
      },
      "description": "Author(s) of the song"
    },
    "subtitle": {
      "type": "array",
      "items": {
        "type": "string"
      },
      "description": "Song subtitle(s)"
    },
    "verses": {
      "type": "array",
      "items": {
        "type": "object",
        "properties": {
          "number": {
            "description": "Verse number",
            "type": "string"
          },
          "text": {
            "description": "Verse lines",
            "type": "array",
            "items": {
              "type": "string"
            },
            "minItems": 1
          },
          "word_by_word": {
            "description": "Word-by-word translation for this verse",
            "type": "array",
            "items": {
              "type": "string"
            }
          },
          "translation": {
            "description": "Verse translation",
            "type": "array",
            "items": {
              "type": "string"
            }
          },
          "subtitle": {
            "description": "Subtitle for this verse or section",
            "type": "array",
            "items": {
              "type": "string"
            }
          }
        },
        "additionalProperties": false
      },
      "description": "Song verses",
      "minItems": 1
    }
  },
  "anyOf": [
    {
      "required": [
        "author"
      ]
    },
    {
      "properties": {
        "meta": {
          "anyOf": [
            {
              "required": [
                "author"
              ]
            },
            {
              "required": [
                "no-author"
              ]
            }
          ]
        }
      }
    }
  ],
  "additionalProperties": false
}