{
  "meta": {
    "page": 120,
    "first_line": "akrodha paramānda nityānanda rāy"
  },
  "title": [
    "Akrodha paramānanda"
  ],
  "word_by_word": [
    "**akrodha** — libre de ira; **parama-ānanda** — suprema bienaventuranza."
  ],
  "author": [
    "Śrīla Lochan Dās Ṭhākur"
  ],
  "verses": [
    {
      "number": "1",
      "text": [
        "akrodha paramānda nityānanda rāy",
        "abhimāna-śūnya nitāi nagare beḍāya"
      ],
      "word_by_word": [
        "**akrodha** — libre de ira; **paramānanda** — bienaventuranza suprema; **nityānanda rāy** — Señor Nityananda; **abhimāna** — ego falso; **śūnya** — vacío; **nitāi** — el Señor Nityananda; **nagare** — en las aldeas; **beḍāya** — deambula."
      ],
      "translation": [
        "La gran personalidad, el Señor Nityānanda Prabhu, está libre de la ira y pleno de éxtasis trascendental. Él recorre todos los pueblos, libre del prestigio falso y la arrogancia."
      ]
    },
    {
      "number": "2",
      "text": [
        "adhama patita jīver dvāre dvāre giyā",
        "harināma mahāmantra dena bilāiyā"
      ],
      "word_by_word": [
        "**adhama** — desdichado; **patita** — caído; **jīvera** — de las almas; **dvāre dvāre** — puerta a puerta; **giyā** — habiéndose ido; **harināma mahā-mantra** — el gran canto de los Santos Nombres; **dena** — Él da; **bilāiyā** — distribuir."
      ],
      "translation": [
        "Va de puerta en puerta a las casas de las almas caídas, distribuyendo liberalmente el *mahāmantra* Hare Kṛṣṇa."
      ]
    },
    {
      "number": "3",
      "text": [
        "jāre dekhe tāre kahe dante tṛṇa kori,",
        "āmāre kiniyā laha bhaja gaurahari"
      ],
      "word_by_word": [
        "**jā’re dekhe** — a quien Él ve; **tā’re kahe** — a ellos les dice; **dante** — en los dientes; **tṛṇa dhari’** — sosteniendo una hierba; **āmāre** — a mí; **kiniyā** — comprar; **laha** — por favor toma; **bhaja** — adorar; **gaurahari** — Señor Gaurahari."
      ],
      "translation": [
        "Con una paja entre Sus dientes, mendiga de todos aquellos que cruzan Su camino: ‘Adoren al Señor Gaurahari y ustedes me comprarán a Mí’."
      ]
    },
    {
      "number": "4",
      "text": [
        "eta bali’ nityānanda bhūme goḍi jay",
        "sonāra parvvata jena dhūlāte loṭāy"
      ],
      "word_by_word": [
        "**eta** — así; **bali’** — habiendo dicho; **nityānanda** — el Señor Nityānanda; **bhūme** — en el suelo; **gaḍi’ jāya** — da vueltas; **sonāra** — hecha de oro; **parvata** — la montaña; **jena** — como; **dhūlāte loṭāy** — cayendo en el polvo."
      ],
      "translation": [
        "Al decir esto, el Señor Nityānanda cae al suelo, pareciendo una montaña dorada que rueda en el polvo."
      ]
    },
    {
      "number": "5",
      "text": [
        "heno avatāre jāra rati nā janmilo",
        "lochan bole sei pāpī elo āra gelo"
      ],
      "word_by_word": [
        "**hena avatāre** — para tal encarnación; **jāra rati** — cuyo afecto; **nā janmilo** — no se ha producido; **lochana** — Lochana Dās Ṭhākur; **bole** — dice; **sei pāpī** — esa persona pecaminosa; **elo** — viene; **āra** — y; **gela** — va (en repetidos nacimientos y muertes)."
      ],
      "translation": [
        "Lochan Dās dice que esa persona pecaminosa, en quien no ha surgido apego por esa encarnación, va y viene dentro del ciclo de nacimientos y muertes repetidos."
      ]
    }
  ]
}