{
  "meta": {
    "page": 999,
    "first_line": "Test song without translation",
    "translation": "no"
  },
  "title": [
    "Song Without Translation"
  ],
  "author": [
    "Test Author"
  ],
  "verses": [
    {
      "number": "1",
      "text": [
        "This song has no translation",
        "Only the original text"
      ]
    }
  ]
}
