{
  "meta": {
    "page": 998,
    "first_line": "Test song with inline verse formatting",
    "styles": {
      "verses": {
        "inline": {
          "bold": false
        }
      }
    }
  },
  "title": [
    "Song With Inline Verse"
  ],
  "author": [
    "Test Author"
  ],
  "verses": [
    {
      "number": "1",
      "text": [
        "This song uses inline verse formatting",
        "The verses are displayed inline"
      ],
      "translation": [
        "This is the translation"
      ]
    }
  ]
}
