{
  "meta": {
    "page": 997,
    "first_line": "Test song with all meta formatting options",
    "translation": "no",
    "author": "Meta Author Name",
    "styles": {
      "verses": {
        "wide": false,
        "align": "left",
        "inline": {
          "bold": false
        }
      }
    }
  },
  "title": [
    "Song With All Meta Formats",
    "Secondary Title"
  ],
  "author": [
    "Root Level Author"
  ],
  "subtitle": [
    "A comprehensive formatting test"
  ],
  "word_by_word": [
    "**word** — translation; **another** — meaning"
  ],
  "verses": [
    {
      "number": "1",
      "text": [
        "First verse with all options"
      ],
      "word_by_word": [
        "**word** — verse level translation"
      ],
      "translation": [
        "This is the translation"
      ],
      "subtitle": [
        "Verse subtitle"
      ]
    },
    {
      "number": "2",
      "text": [
        "Second verse"
      ],
      "translation": [
        "Another translation"
      ]
    }
  ]
}
